{
  "profileId": "spotcomp-implementation-core-v0",
  "evidence": [
    "library/implementation/specification.md",
    "TRACE-AXES.md",
    "CANONICAL-IDENTITY.md",
    "library/trc-tdp/specification.md"
  ],
  "derivationDirection": [
    "aperiodic-articulating",
    "transfinite-predicating",
    "scott-continuous-positing",
    "finite-settling"
  ],
  "traceCarrier": {
    "exactEavtRows": true,
    "eSubjectCoordinate": true,
    "aPredicateCoordinate": true,
    "vObjectCoordinateNotPrivilegedBilatticeField": true,
    "tTransactionCoordinate": true,
    "noHiddenAxisFields": true,
    "correctionsAreNewRows": true,
    "identityNotLineOffsetArrivalOrderArrayIndexOrDatabaseKey": true,
    "finiteCarrierNotWholeTraceObject": true,
    "evidence": [
      "library/implementation/specification.md#2-trace-carrier-rules",
      "TRACE-AXES.md#4-event-records-and-rows"
    ]
  },
  "jsonlAndStreams": {
    "jsonlOneCompleteJsonObjectPerLfLine": true,
    "jsonlIdentityItemByItem": true,
    "jsonlNotInternetWireStandard": true,
    "rfc7464JsonTextSequencesConservativeWireProfile": true,
    "jsonSeqUsesApplicationJsonSeq": true,
    "noCanonicalSequenceBytesWithoutManifest": true,
    "signedStreamsUseCanonicalItemsOrManifest": true,
    "evidence": [
      "library/implementation/specification.md#3-jsonl-and-stream-identity",
      "CANONICAL-IDENTITY.md#5-streams-and-jsonl",
      "WIRE-PROFILES.md#2-registered-versus-candidate-media-types"
    ]
  },
  "canonicalIdentity": {
    "rowIdFormulaSha256JcsRow": true,
    "exactEavtCanonicalization": true,
    "duplicateNamesRejected": true,
    "unicodePreservedWithoutNormalization": true,
    "numbersWithinJcsIJsonBoundaryOrTypedStrings": true,
    "recursiveObjectPropertySorting": true,
    "arrayOrderPreserved": true,
    "canonicalWhitespaceElided": true,
    "sameCanonicalIdSameMergeEvent": true,
    "differentCanonicalIdsRemainDistinct": true,
    "evidence": [
      "library/implementation/specification.md#4-canonical-row-identity",
      "CANONICAL-IDENTITY.md#1-boundary"
    ]
  },
  "appendMerge": {
    "appendOnlyTraceStorage": true,
    "mergeByCanonicalRowIdGSetUnion": true,
    "appendMonotonicity": true,
    "mergeCommutative": true,
    "mergeAssociative": true,
    "mergeIdempotent": true,
    "canonicalizationFailuresRejectedOrQuarantined": true,
    "indexesCachesSnapshotsNonAuthoritative": true,
    "doesNotProveFullTraceMonoidSettlementFunctor": true,
    "evidence": [
      "library/implementation/specification.md#5-append-and-merge",
      "INFORMATION-COMPUTERS.md#4-persistence-and-federation"
    ]
  },
  "recognitionAdmission": {
    "parsingIsNotAdmission": true,
    "shapeValidityIsNotAdmission": true,
    "signatureValidityIsNotAdmission": true,
    "profileRecognitionBeforeAdmission": true,
    "canonicalIdentityCheckedBeforeTrust": true,
    "signatureVerificationBeforeMerge": true,
    "objectKindAndTraceAxesRecognized": true,
    "governanceAndCapabilityGatesApplied": true,
    "modeledPlayerObservationActionBoundsAppliedWhenRelevant": true,
    "acceptedEvidenceAppendedOnlyAfterAdmission": true,
    "failedAdmissionRecordedAsAuditOrDowngrade": true,
    "evidence": [
      "library/implementation/specification.md#6-recognition-and-admission",
      "RECOGNITION.md",
      "GOVERNANCE.md"
    ]
  },
  "trcTdpRuntime": {
    "trcAndTdpSameOnDiskObject": true,
    "catalogRootDeclared": true,
    "typedResourceSchemasDeclared": true,
    "traceLogsAsInhabitingEvidence": true,
    "scriptsAsMorphismWitnesses": true,
    "schemaLogScriptColocation": true,
    "dualFilingAtSubjectAndPredicateAnchors": true,
    "canonicalIdentityPreservedAcrossDualFiling": true,
    "replayFromTraceEvidence": true,
    "closureExecutionOutcomeDeclared": true,
    "evidence": [
      "library/implementation/specification.md#7-trctdp-runtime-surface",
      "library/trc-tdp/specification.md"
    ]
  },
  "pamClosure": {
    "entitySetDeclared": true,
    "predicateCategoryOrGraphDeclared": true,
    "valueAlgebraDeclared": true,
    "fiberAlgebraOrSpecializationDeclared": true,
    "externalMutationUsesReifiedMessages": true,
    "eventReplayIntoGeometry": true,
    "monotoneRuleDispatch": true,
    "readsProduceWitnesses": true,
    "fixedPointPrefixFuelBoundOrDowngradeStatus": true,
    "fourNotUniversalValueSubstrate": true,
    "evidence": [
      "library/implementation/specification.md#8-pam-and-closure-surface",
      "library/pam/specification.md"
    ]
  },
  "packetProjection": {
    "shpFiniteSemanticHypertextPacket": true,
    "packetsAreProjectionObjects": true,
    "sourceTraceOrTraceFamilyDeclared": true,
    "finiteFrontierDeclared": true,
    "settlementEvidenceDeclared": true,
    "projectionMorphismDeclared": true,
    "deterministicMonotoneProjection": true,
    "classesAsMorphismIdentities": true,
    "dataAttributesAsCarrierCoordinates": true,
    "noScriptExecution": true,
    "noRequiredExternalResourcesForSemantics": true,
    "packetDoesNotReplaceTraceCatalogPlayerOrStrategy": true,
    "evidence": [
      "library/implementation/specification.md#9-shp-packet-surface",
      "library/shp/specification.md"
    ]
  },
  "wireFederation": {
    "wireSurfacesAreMathematicalMorphisms": true,
    "objectBoundaryFixedBeforeWireClaims": true,
    "rfc8259JsonDeclared": true,
    "rfc8785CanonicalJsonDeclared": true,
    "rfc7464JsonTextSequencesDeclared": true,
    "rfc9110ContentTypeDeclaredForHttp": true,
    "rfc9457ProblemDetailsDeclared": true,
    "rfc8032Ed25519DeclaredWhenUsed": true,
    "mediaTypeRegistrationDisciplineDeclared": true,
    "signatureVerificationBeforeTraceMerge": true,
    "governanceAndRecognitionAfterSignatureVerification": true,
    "evidence": [
      "library/implementation/specification.md#10-wire-and-federation-surface",
      "library/wire-federation/specification.md"
    ]
  },
  "modeledPlayerRuntime": {
    "externalPlayerBoundaryDeclared": true,
    "modeledPlayerIdentifierDeclared": true,
    "observerLocalSettlingDeclared": true,
    "perObserverRuleSystemDeclared": true,
    "identityAuthorityDeclaredWhenApplicable": true,
    "capabilitiesAndGovernanceDeclared": true,
    "handednessDeclared": true,
    "inputAndOutputTraceReferencesDeclared": true,
    "playerLocalPartialObservation": true,
    "cgsStrategyReferenceOrDowngrade": true,
    "learningTransitionPolicyDeclared": true,
    "outputRowsRequireAttributionGovernanceCapabilityObservationSettlingAndStrategyBoundaries": true,
    "evidence": [
      "library/implementation/specification.md#11-modeled-player-runtime-surface",
      "library/modeled-player/specification.md"
    ]
  },
  "operationsRuntime": {
    "beingDoingWorkingGoverningWitnesses": true,
    "processProcedureDerivationInquiryWorkTypes": true,
    "operationsLoopStagesDeclared": true,
    "processAndProcedureRecordsDeclared": true,
    "ledgersAsBalancedWitnessProjections": true,
    "budgetsWithScopeExhaustionAndCoherenceEvidence": true,
    "lawvereQuantaleCostComposition": true,
    "stationarityAndLaplacianHandoffDeclared": true,
    "operationalRecordsAreSubstrateContent": true,
    "evidence": [
      "library/implementation/specification.md#12-operations-surface",
      "library/operations/specification.md"
    ]
  },
  "minimumRuntimeComponents": {
    "components": [
      "trace-parser",
      "duplicate-detecting-json-importer-or-downgrade",
      "canonical-row-id-calculator",
      "append-only-trace-store",
      "g-set-merge-engine",
      "envelope-signer-verifier",
      "admission-recognition-gate",
      "governance-capability-gate",
      "trc-tdp-catalog-resolver",
      "replay-closure-executor",
      "pam-message-reification-interface",
      "finite-projection-engine",
      "shp-producer",
      "wire-profile-handler",
      "modeled-player-registry",
      "player-local-observation-action-loop",
      "cgs-declaration-linker",
      "learning-transition-recorder",
      "operations-ledger-budget-cost-recorder",
      "audit-downgrade-recorder"
    ],
    "evidence": [
      "library/implementation/specification.md#13-minimum-runtime-components"
    ]
  },
  "nonConformanceBoundary": {
    "noRowOrderLineNumberOrDatabaseIdAsTraceIdentity": true,
    "noExtraRowFieldsAsTraceAxes": true,
    "noSilentDuplicateJsonNameDiscardForStrongIdentity": true,
    "noHistoricalRowMutation": true,
    "noMergeAfterSignatureWithoutRecognitionGovernanceAdmission": true,
    "noJsonlAsInternetWireStandard": true,
    "noPacketOrTransportOutsideMathematics": true,
    "noPacketOrTransportAsWholeMathematics": true,
    "noKeysInboxesOrOutboxesAsModeledPlayers": true,
    "noCgsClaimWithoutEventStructureAndStrategyLaws": true,
    "noHiddenLearningCostBudgetOrRejectionEvidence": true,
    "evidence": [
      "library/implementation/specification.md#14-non-conformance-cases"
    ]
  }
}
